{
  "note": {
    "id": "019a1c00-0000-7000-8000-000000000302",
    "client_id": "6f1c2b3a-4d5e-4f7a-8b9c-0d1e2f3a4b02",
    "status": "done",
    "name": "Update: Old reading list",
    "text": "delete old reading list, done email prof",
    "source_file_name": null,
    "written_at": "2026-10-23T08:12:00+07:00",
    "processed_at": "2026-10-23T08:12:01+07:00",
    "engine": "rules"
  },
  "changes": [
    {
      "kind": "updated",
      "label": "Completed",
      "task": {
        "id": "019a1c00-0000-7000-8000-000000000204",
        "title": "Email Prof. Kim",
        "due_date": null,
        "start_time": null,
        "end_time": null,
        "priority": null,
        "project_id": null,
        "repeat": "never",
        "reminder": "none",
        "notes": null,
        "done": true,
        "done_at": "2026-10-23T08:13:10+07:00",
        "created_by": "user",
        "source_note_id": null,
        "created_at": "2026-10-23T08:12:00+07:00",
        "updated_at": "2026-10-23T08:13:10+07:00"
      }
    },
    {
      "kind": "deleted",
      "label": "Old reading list",
      "task": {
        "id": "019a1c00-0000-7000-8000-000000000205",
        "title": "Old reading list",
        "due_date": null,
        "start_time": null,
        "end_time": null,
        "priority": null,
        "project_id": null,
        "repeat": "never",
        "reminder": "none",
        "notes": null,
        "done": false,
        "done_at": null,
        "created_by": "user",
        "source_note_id": null,
        "created_at": "2026-10-23T08:12:00+07:00",
        "updated_at": "2026-10-23T08:12:00+07:00"
      }
    }
  ],
  "plan": null,
  "skipped": [],
  "ambiguous": []
}
