{
  "note": {
    "id": "019a1c00-0000-7000-8000-000000000303",
    "client_id": "6f1c2b3a-4d5e-4f7a-8b9c-0d1e2f3a4b03",
    "status": "confirm",
    "name": "This week",
    "text": "read chapter 4 mon, lab report tue, wireframes tue, deploy demo wed, update cv thu, call mom sat",
    "source_file_name": null,
    "written_at": "2026-10-23T08:12:00+07:00",
    "processed_at": "2026-10-23T08:12:01+07:00",
    "engine": "rules"
  },
  "changes": [],
  "plan": {
    "create": [
      {
        "ref": "c1",
        "title": "Read chapter 4",
        "due_date": "2026-10-26",
        "start_time": null,
        "end_time": null,
        "priority": null,
        "project_id": "019a1c00-0000-7000-8000-000000000101",
        "repeat": "never",
        "reminder": "none",
        "notes": null,
        "duplicate_of": null
      },
      {
        "ref": "c2",
        "title": "Lab report",
        "due_date": "2026-10-27",
        "start_time": null,
        "end_time": null,
        "priority": null,
        "project_id": "019a1c00-0000-7000-8000-000000000101",
        "repeat": "never",
        "reminder": "none",
        "notes": null,
        "duplicate_of": null
      },
      {
        "ref": "c3",
        "title": "Wireframes",
        "due_date": "2026-10-27",
        "start_time": null,
        "end_time": null,
        "priority": null,
        "project_id": "019a1c00-0000-7000-8000-000000000103",
        "repeat": "never",
        "reminder": "none",
        "notes": null,
        "duplicate_of": null
      },
      {
        "ref": "c4",
        "title": "Deploy demo",
        "due_date": "2026-10-28",
        "start_time": null,
        "end_time": null,
        "priority": null,
        "project_id": "019a1c00-0000-7000-8000-000000000102",
        "repeat": "never",
        "reminder": "none",
        "notes": null,
        "duplicate_of": null
      },
      {
        "ref": "c5",
        "title": "Update CV",
        "due_date": "2026-10-29",
        "start_time": null,
        "end_time": null,
        "priority": null,
        "project_id": "019a1c00-0000-7000-8000-000000000104",
        "repeat": "never",
        "reminder": "none",
        "notes": null,
        "duplicate_of": null
      },
      {
        "ref": "c6",
        "title": "Call mom",
        "due_date": "2026-10-31",
        "start_time": null,
        "end_time": null,
        "priority": null,
        "project_id": "019a1c00-0000-7000-8000-000000000105",
        "repeat": "never",
        "reminder": "none",
        "notes": null,
        "duplicate_of": null
      }
    ],
    "update": [],
    "delete": []
  },
  "skipped": [],
  "ambiguous": []
}
